{
  "id": "entitlement_019c0000000070008000000000000002",
  "subject": "gateway-client",
  "workspace": "research-team",
  "policy_epoch": 11,
  "routes": [
    {
      "endpoint": "chat-primary",
      "provider": "vertex",
      "model": "gemini-pro"
    }
  ],
  "maximum_request": {
    "requests": 1,
    "input_tokens": 1000,
    "output_tokens": 500,
    "cost_micros": 5000
  },
  "not_before": "2026-08-21T08:59:00Z",
  "expires_at": "2026-08-21T10:00:00Z",
  "resource_version": "rv1:1:sha256:bbbbbbbbbbbbbbbbbbbbbbbbbbbbbbbbbbbbbbbbbbbbbbbbbbbbbbbbbbbbbbbb"
}
